============================= test session starts ==============================
platform linux -- Python 3.12.12, pytest-9.0.2, pluggy-1.6.0
rootdir: /app
configfile: pyproject.toml
testpaths: tests
plugins: cov-7.0.0
collected 6 items / 7 errors

==================================== ERRORS ====================================
_______ ERROR collecting tests/integration/test_generator_integration.py _______
tests/integration/test_generator_integration.py:2: in <module>
    from mlip_autopipec.components.generator.adaptive import AdaptiveGenerator
src/mlip_autopipec/components/generator/__init__.py:1: in <module>
    from mlip_autopipec.components.generator.adaptive import AdaptiveGenerator
src/mlip_autopipec/components/generator/adaptive.py:5: in <module>
    from mlip_autopipec.components.generator.base import BaseGenerator
src/mlip_autopipec/components/generator/base.py:5: in <module>
    from mlip_autopipec.domain_models.config import GeneratorConfig
src/mlip_autopipec/domain_models/__init__.py:3: in <module>
    from .structure import Structure
src/mlip_autopipec/domain_models/structure.py:35: in <module>
    class Structure(BaseModel):
.venv/lib/python3.12/site-packages/pydantic/_internal/_model_construction.py:132: in __new__
    private_attributes = inspect_namespace(
.venv/lib/python3.12/site-packages/pydantic/_internal/_model_construction.py:481: in inspect_namespace
    raise PydanticUserError(
E   pydantic.errors.PydanticUserError: A non-annotated attribute was detected: `MAX_ATOMIC_NUMBER = 118`. All model fields require a type annotation; if `MAX_ATOMIC_NUMBER` is not meant to be a field, you may be able to resolve this error by annotating it as a `ClassVar` or updating `model_config['ignored_types']`.
E
E   For further information visit https://errors.pydantic.dev/2.12/u/model-field-missing-annotation
_________ ERROR collecting tests/integration/test_orchestrator_mock.py _________
tests/integration/test_orchestrator_mock.py:6: in <module>
    from mlip_autopipec.components.oracle.mock import MockOracle
src/mlip_autopipec/components/oracle/__init__.py:1: in <module>
    from .base import BaseOracle
src/mlip_autopipec/components/oracle/base.py:5: in <module>
    from mlip_autopipec.domain_models.structure import Structure
src/mlip_autopipec/domain_models/__init__.py:3: in <module>
    from .structure import Structure
src/mlip_autopipec/domain_models/structure.py:35: in <module>
    class Structure(BaseModel):
.venv/lib/python3.12/site-packages/pydantic/_internal/_model_construction.py:132: in __new__
    private_attributes = inspect_namespace(
.venv/lib/python3.12/site-packages/pydantic/_internal/_model_construction.py:481: in inspect_namespace
    raise PydanticUserError(
E   pydantic.errors.PydanticUserError: A non-annotated attribute was detected: `MAX_ATOMIC_NUMBER = 118`. All model fields require a type annotation; if `MAX_ATOMIC_NUMBER` is not meant to be a field, you may be able to resolve this error by annotating it as a `ClassVar` or updating `model_config['ignored_types']`.
E
E   For further information visit https://errors.pydantic.dev/2.12/u/model-field-missing-annotation
_________________ ERROR collecting tests/unit/test_dataset.py __________________
tests/unit/test_dataset.py:6: in <module>
    from mlip_autopipec.core.dataset import Dataset
src/mlip_autopipec/core/dataset.py:7: in <module>
    from mlip_autopipec.domain_models.structure import Structure
src/mlip_autopipec/domain_models/__init__.py:3: in <module>
    from .structure import Structure
src/mlip_autopipec/domain_models/structure.py:35: in <module>
    class Structure(BaseModel):
.venv/lib/python3.12/site-packages/pydantic/_internal/_model_construction.py:132: in __new__
    private_attributes = inspect_namespace(
.venv/lib/python3.12/site-packages/pydantic/_internal/_model_construction.py:481: in inspect_namespace
    raise PydanticUserError(
E   pydantic.errors.PydanticUserError: A non-annotated attribute was detected: `MAX_ATOMIC_NUMBER = 118`. All model fields require a type annotation; if `MAX_ATOMIC_NUMBER` is not meant to be a field, you may be able to resolve this error by annotating it as a `ClassVar` or updating `model_config['ignored_types']`.
E
E   For further information visit https://errors.pydantic.dev/2.12/u/model-field-missing-annotation
_________________ ERROR collecting tests/unit/test_factory.py __________________
tests/unit/test_factory.py:3: in <module>
    from mlip_autopipec.components.dynamics.mock import MockDynamics
src/mlip_autopipec/components/dynamics/__init__.py:1: in <module>
    from .base import BaseDynamics
src/mlip_autopipec/components/dynamics/base.py:6: in <module>
    from mlip_autopipec.domain_models.structure import Structure
src/mlip_autopipec/domain_models/__init__.py:3: in <module>
    from .structure import Structure
src/mlip_autopipec/domain_models/structure.py:35: in <module>
    class Structure(BaseModel):
.venv/lib/python3.12/site-packages/pydantic/_internal/_model_construction.py:132: in __new__
    private_attributes = inspect_namespace(
.venv/lib/python3.12/site-packages/pydantic/_internal/_model_construction.py:481: in inspect_namespace
    raise PydanticUserError(
E   pydantic.errors.PydanticUserError: A non-annotated attribute was detected: `MAX_ATOMIC_NUMBER = 118`. All model fields require a type annotation; if `MAX_ATOMIC_NUMBER` is not meant to be a field, you may be able to resolve this error by annotating it as a `ClassVar` or updating `model_config['ignored_types']`.
E
E   For further information visit https://errors.pydantic.dev/2.12/u/model-field-missing-annotation
___________ ERROR collecting tests/unit/test_generator_components.py ___________
tests/unit/test_generator_components.py:6: in <module>
    from mlip_autopipec.components.generator.builder import BulkBuilder, SurfaceBuilder
src/mlip_autopipec/components/generator/__init__.py:1: in <module>
    from mlip_autopipec.components.generator.adaptive import AdaptiveGenerator
src/mlip_autopipec/components/generator/adaptive.py:5: in <module>
    from mlip_autopipec.components.generator.base import BaseGenerator
src/mlip_autopipec/components/generator/base.py:6: in <module>
    from mlip_autopipec.domain_models.structure import Structure
src/mlip_autopipec/domain_models/__init__.py:3: in <module>
    from .structure import Structure
src/mlip_autopipec/domain_models/structure.py:35: in <module>
    class Structure(BaseModel):
.venv/lib/python3.12/site-packages/pydantic/_internal/_model_construction.py:132: in __new__
    private_attributes = inspect_namespace(
.venv/lib/python3.12/site-packages/pydantic/_internal/_model_construction.py:481: in inspect_namespace
    raise PydanticUserError(
E   pydantic.errors.PydanticUserError: A non-annotated attribute was detected: `MAX_ATOMIC_NUMBER = 118`. All model fields require a type annotation; if `MAX_ATOMIC_NUMBER` is not meant to be a field, you may be able to resolve this error by annotating it as a `ClassVar` or updating `model_config['ignored_types']`.
E
E   For further information visit https://errors.pydantic.dev/2.12/u/model-field-missing-annotation
_______________ ERROR collecting tests/unit/test_oracle_mock.py ________________
tests/unit/test_oracle_mock.py:3: in <module>
    from mlip_autopipec.components.oracle.mock import MockOracle
src/mlip_autopipec/components/oracle/__init__.py:1: in <module>
    from .base import BaseOracle
src/mlip_autopipec/components/oracle/base.py:5: in <module>
    from mlip_autopipec.domain_models.structure import Structure
src/mlip_autopipec/domain_models/__init__.py:3: in <module>
    from .structure import Structure
src/mlip_autopipec/domain_models/structure.py:35: in <module>
    class Structure(BaseModel):
.venv/lib/python3.12/site-packages/pydantic/_internal/_model_construction.py:132: in __new__
    private_attributes = inspect_namespace(
.venv/lib/python3.12/site-packages/pydantic/_internal/_model_construction.py:481: in inspect_namespace
    raise PydanticUserError(
E   pydantic.errors.PydanticUserError: A non-annotated attribute was detected: `MAX_ATOMIC_NUMBER = 118`. All model fields require a type annotation; if `MAX_ATOMIC_NUMBER` is not meant to be a field, you may be able to resolve this error by annotating it as a `ClassVar` or updating `model_config['ignored_types']`.
E
E   For further information visit https://errors.pydantic.dev/2.12/u/model-field-missing-annotation
________________ ERROR collecting tests/unit/test_structure.py _________________
tests/unit/test_structure.py:5: in <module>
    from mlip_autopipec.domain_models.structure import Structure
src/mlip_autopipec/domain_models/__init__.py:3: in <module>
    from .structure import Structure
src/mlip_autopipec/domain_models/structure.py:35: in <module>
    class Structure(BaseModel):
.venv/lib/python3.12/site-packages/pydantic/_internal/_model_construction.py:132: in __new__
    private_attributes = inspect_namespace(
.venv/lib/python3.12/site-packages/pydantic/_internal/_model_construction.py:481: in inspect_namespace
    raise PydanticUserError(
E   pydantic.errors.PydanticUserError: A non-annotated attribute was detected: `MAX_ATOMIC_NUMBER = 118`. All model fields require a type annotation; if `MAX_ATOMIC_NUMBER` is not meant to be a field, you may be able to resolve this error by annotating it as a `ClassVar` or updating `model_config['ignored_types']`.
E
E   For further information visit https://errors.pydantic.dev/2.12/u/model-field-missing-annotation
=========================== short test summary info ============================
ERROR tests/integration/test_generator_integration.py - pydantic.errors.Pydan...
ERROR tests/integration/test_orchestrator_mock.py - pydantic.errors.PydanticU...
ERROR tests/unit/test_dataset.py - pydantic.errors.PydanticUserError: A non-a...
ERROR tests/unit/test_factory.py - pydantic.errors.PydanticUserError: A non-a...
ERROR tests/unit/test_generator_components.py - pydantic.errors.PydanticUserE...
ERROR tests/unit/test_oracle_mock.py - pydantic.errors.PydanticUserError: A n...
ERROR tests/unit/test_structure.py - pydantic.errors.PydanticUserError: A non...
!!!!!!!!!!!!!!!!!!! Interrupted: 7 errors during collection !!!!!!!!!!!!!!!!!!!!
============================== 7 errors in 1.89s ===============================
